{
  "schema_version": 2,
  "id": "x-square",
  "name": "自变量机器人",
  "aliases": [
    "自变量机器人(X Square)",
    "X Square"
  ],
  "category_id": "08",
  "focus": "端到端具身基础模型及通用机器人",
  "products": "WALL-B世界统一模型；量子系列机器人与数据基础设施",
  "locations_text": "深圳；北京",
  "comparison": {
    "kind": "editorial_analysis",
    "summary": "分析：相较以运动控制为主的足式公司，突出从感知到动作统一学习、模型与机器人协同。",
    "peer_names": [
      "银河通用；千寻智能；星海图"
    ]
  },
  "investment": {
    "summary": "公司2026-06-29公告披露连续四轮融资至C轮，估值超过28亿美元；公司公告介绍字节、阿里云、美团、小米等战略资本背景。融资金额和估值为该时点公司披露。",
    "verification_status": "confirmed_disclosure"
  },
  "contacts": {
    "website": "https://x2robot.com/",
    "careers_url": "https://x2-robot.jobs.feishu.cn/",
    "recruitment_email": "hr@x2robot.com",
    "other_email": "coop@x2robot.com",
    "other_email_purpose": "商业合作"
  },
  "notes": "邮箱为公开招聘渠道；岗位及开放状态以招聘页面为准。",
  "checked_at": "2026-10-30",
  "sources": [
    {
      "id": "s01",
      "title": "自变量公司融资公告",
      "url": "https://www.prnewswire.com/news-releases/x-square-robot-secures-four-consecutive-financing-rounds-surpasses-us2-8-billion-valuation-in-push-for-physical-ai-foundation-models-302813091.html",
      "supports": "投资背景、业务与城市",
      "published_date": "2026-06-29",
      "checked_at": "2026-10-30"
    },
    {
      "id": "s02",
      "title": "自变量加入我们",
      "url": "https://x2robot.com/join",
      "supports": "官网、产品及招聘跳转",
      "published_date": null,
      "checked_at": "2026-10-30"
    },
    {
      "id": "s03",
      "title": "自变量社会招聘",
      "url": "https://x2-robot.jobs.feishu.cn/",
      "supports": "招聘邮箱与商务邮箱",
      "published_date": null,
      "checked_at": "2026-10-30"
    }
  ],
  "provenance": {
    "original_name": "自变量机器人(X Square)",
    "original_track": "07",
    "original_subtrack": "具身大模型（大脑/VLA）与通用操作"
  },
  "organization_type": "operating_organization",
  "targeting": {
    "kind": "editorial_assessment",
    "player_group": "new_entrant",
    "wave": "first",
    "rationale": "按现有AI产品、业务与资本披露列为第一波研究候选；这是编辑归类，不表示成立时间、法律独立性和当前存续状态已全项重查。",
    "source_ids": [
      "s01",
      "s02"
    ],
    "labelled_at": "2026-10-31"
  },
  "channels": []
}
