{
  "schema_version": 2,
  "id": "deepdraw",
  "name": "深绘智能 / Deepdraw",
  "aliases": [
    "深绘智能"
  ],
  "category_id": "07",
  "focus": "时尚商品中台与商品数字化",
  "products": "PIM商品中台、美工机器人、商品数据平台",
  "locations_text": "杭州",
  "comparison": {
    "kind": "editorial_analysis",
    "summary": "分析：与极睿生成商拍内容相邻，但重点是商品主数据与内容中台，且已是上市公司光云旗下主体。",
    "peer_names": [
      "极睿科技"
    ]
  },
  "investment": {
    "summary": "光云科技2021年以1.2亿元收购100%股权，2021-01完成工商变更并纳入合并；应标为产业收购背景，而非独立VC融资企业。",
    "verification_status": "confirmed_disclosure"
  },
  "contacts": {
    "website": "https://www.deepdraw.cn/",
    "careers_url": null,
    "recruitment_email": null,
    "other_email": null,
    "other_email_purpose": null
  },
  "notes": "现行独立招聘入口与邮箱未查到，可从光云体系核实。；未查到当前公开招聘入口或投递邮箱。",
  "checked_at": "2026-10-30",
  "sources": [
    {
      "id": "s01",
      "title": "深绘官网",
      "url": "https://www.deepdraw.cn/",
      "supports": "产品和方向",
      "published_date": null,
      "checked_at": "2026-10-30"
    },
    {
      "id": "s02",
      "title": "光云科技2021财报附注",
      "url": "https://static.sse.com.cn/stock/disclosure/announcement/c/202208/688365_20220805_6WXN.pdf",
      "supports": "收购并表与股权",
      "published_date": "2022-08-05",
      "checked_at": "2026-10-30"
    }
  ],
  "provenance": {
    "original_name": "深绘智能",
    "original_track": "06",
    "original_subtrack": "电商AIGC商拍、直播切片与商业视频"
  },
  "organization_type": "operating_organization",
  "targeting": {
    "kind": "editorial_assessment",
    "player_group": "incumbent",
    "wave": "later",
    "rationale": "披露确认被光云科技100%收购并纳入合并，本轮不作为独立新进机构。",
    "source_ids": [
      "s01",
      "s02"
    ],
    "labelled_at": "2026-10-31"
  },
  "channels": []
}
