{
  "schema_version": 2,
  "id": "haivivi",
  "name": "跃然创新 Haivivi",
  "aliases": [
    "跃然创新(Haivivi)",
    "Haivivi"
  ],
  "category_id": "09",
  "focus": "AI玩具、语音互动与陪伴",
  "products": "BubblePal；CocoMate；Haivivi App",
  "locations_text": "深圳（公司总部联系地址）",
  "comparison": {
    "kind": "editorial_analysis",
    "summary": "分析：相较Plaud和viaim的办公生产力硬件，Haivivi以玩具和IP角色互动、儿童及情感陪伴为主要产品场景。",
    "peer_names": [
      "未来智能 viaim；Plaud"
    ]
  },
  "investment": {
    "summary": "2025-08-25披露2亿元A轮系列融资，中金资本旗下基金、红杉中国、华山资本、愉悦资本领投，招银国际等参投，Brizan Ventures等老股东加注。",
    "verification_status": "confirmed_disclosure"
  },
  "contacts": {
    "website": "https://www.haivivi.cn/",
    "careers_url": "https://m.zhipin.com/companys/ff637f836e8ccf6b03B43N69FlE~.html",
    "recruitment_email": null,
    "other_email": "bd@haivivi.com",
    "other_email_purpose": "经销商/商业合作"
  },
  "notes": "未查到公开招聘邮箱；可通过BOSS直聘深圳跃然创新公司页投递。页面明确对应HAIVIVI品牌且展示人事经理等招聘者。bd@为经销合作，不能当投递邮箱。",
  "checked_at": "2026-10-30",
  "sources": [
    {
      "id": "s01",
      "title": "跃然创新完成2亿元A轮系列融资",
      "url": "https://m.jiemian.com/article/13234208.html",
      "supports": "投资方及CocoMate",
      "published_date": "2025-08-25",
      "checked_at": "2026-10-30"
    },
    {
      "id": "s02",
      "title": "Haivivi官网",
      "url": "https://www.haivivi.cn/",
      "supports": "产品与业务方向",
      "published_date": null,
      "checked_at": "2026-10-30"
    },
    {
      "id": "s03",
      "title": "Haivivi联系我们",
      "url": "https://www.haivivi.cn/contact-us",
      "supports": "总部与商务邮箱",
      "published_date": null,
      "checked_at": "2026-10-30"
    },
    {
      "id": "s04",
      "title": "BOSS直聘：深圳跃然创新科技有限公司",
      "url": "https://m.zhipin.com/companys/ff637f836e8ccf6b03B43N69FlE~.html",
      "supports": "HAIVIVI品牌与招聘者、投递入口",
      "published_date": null,
      "checked_at": "2026-10-30"
    }
  ],
  "provenance": {
    "original_name": "跃然创新(Haivivi)",
    "original_track": "08",
    "original_subtrack": "AI穿戴/外骨骼、录音生产力与陪伴硬件"
  },
  "organization_type": "operating_organization",
  "targeting": {
    "kind": "editorial_assessment",
    "player_group": "new_entrant",
    "wave": "first",
    "rationale": "按现有AI产品、业务与资本披露列为第一波研究候选；这是编辑归类，不表示成立时间、法律独立性和当前存续状态已全项重查。",
    "source_ids": [
      "s01",
      "s02"
    ],
    "labelled_at": "2026-10-31"
  },
  "channels": []
}
